{
  "schema_version": "1.0.0",
  "provenance_id": "provenance-1",
  "created_at": "2026-07-21T00:00:00Z",
  "sources": [{ "source_id": "capture", "uri": "capture.dets", "sha256": "bbbbbbbbbbbbbbbbbbbbbbbbbbbbbbbbbbbbbbbbbbbbbbbbbbbbbbbbbbbbbbbb", "policy": "reference" }],
  "adapter": { "id": "stim.dets", "version": "1.0.0" },
  "mapping_decisions": [],
  "unit_conversions": [],
  "revision_references": [],
  "environment": { "runtime": "python", "runtime_version": "3.12", "dependencies": {} },
  "parent_dataset_ids": [],
  "transformations": [],
  "filters": [],
  "exclusions": [],
  "recipes": [],
  "annotations": [],
  "control_audit_refs": []
}
